N0001,A los ninos les gusta la comida,"Lorem Ipsum is simply dummy text of the printing and typesetting industry. Lorem Ipsum has been the industry's standard dummy text ever since the 1500s, when an unknown printer took a galley of type and scrambled it to make a type specimen book. It has survived not only five centuries, but also the leap into electronic typesetting, remaining e",01/01/2018
N0002,A los ninos les gusta la musica,"essentially unchanged. It was popularised in the 1960s with the release of Letraset sheets containing Lorem Ipsum passages, and more recently with desktop publishing software like Aldus PageMaker including versions of Lorem Ipsum.",02/01/2018
N0003,Juan Rulfo Revive y dona a ninosyninas,"It is a long established fact that a reader will be distracted by the readable content of a page when looking at its layout. The point of using Lorem Ipsum is that it has a more-or-less normal distribution of letters, as opposed to using 'Content here, content here',",03/01/2018
N0004,"Michael Jackson no esta muerto, resulta ser donador de ninosyninas","making it look like readable English. Many desktop publishing packages and web page editors now use Lorem Ipsum as their default model text, and a search for 'lorem ipsum' will uncover many web sites still in their infancy. Various versions have evolved over the years, sometimes by accident, sometimes on purpose (injected humour and the like).",04/01/2018
N0005,Desdubre como ninosyninas ha resultado ser la organizacion mas fundada del mundo,"Contrary to popular belief, Lorem Ipsum is not simply random text. It has roots in a piece of classical Latin literature from 45 BC, making it over 2000 years old. Richard McClintock, a Latin professor at Hampden-Sydney College in Virginia, looked up one of the more obscure Latin words, consectetur, from a Lorem Ipsum passage, and going through the c",05/01/2018
N0006,los ninos de ninosyninas estan cansados de que les digamos ninos,"cites of the word in classical literature, discovered the undoubtable source. Lorem Ipsum comes from sections 1.10.32 and 1.10.33 of ""de Finibus Bonorum et Malorum"" (The Extremes of Good and Evil) by Cicero, written in 45 BC. This book is a treatise on the theory of e",06/01/2018
N0007,Titulo generico de noticia,"f ethics, very popular during the Renaissance. The first line of Lorem Ipsum, ""Lorem ipsum dolor sit amet.."", comes from a line in section 1.10.32.",07/01/2018
N0008,"Termintaor Genisis genera 500 millones de dolares en Box Office, la mitad de las donaciones diarias de ninosyninas","There are many variations of passages of Lorem Ipsum available, but the majority have suffered alteration in some form, by injected humour, or randomised words which don't look even slightly believable. If you are going to use a passage of Lorem Ipsum, you need to be sure there isn't anything embarrassing hidden in the middle of text. All the Lorem Ipsum generators on the Internet tend to repeat predefined ch",08/01/2018
N0009,Ronladinho se retira y dona toda su fortuna a ninosyninas,"chunks as necessary, making this the first true generator on the Internet. It uses a dictionary of over 200 Latin words, combined with a handful",09/01/2018
N0010,"Lorem Ipsum, Ipsum Lorem","of model sentence structures, to generate Lorem Ipsum which looks reasonable. The generated Lorem Ipsum is therefore always free from repetition, injected humour, or non-characteristic words etc.",10/01/2018